{
  "schema": "dryer.flash-plan/v0.2",
  "mode": "dry_run",
  "ready": false,
  "controller": "mainboard",
  "lock_hash": "sha256:a4a5e7876b44d72279f48f1868b3dd2e08c5aa5e63dde12e0a43186ced4d51d1",
  "board": "boards/example-mainboard@1.0.0",
  "method": "dfu",
  "transport": "usb",
  "device_selection": {
    "rule": {
      "usb_vid": 4617,
      "usb_pid": 53251
    },
    "status": "unique",
    "candidates": [
      {
        "platform": "fixture",
        "bus_id": "usb-fixture-0",
        "location": "fixture-port-2.1",
        "device_address": 7,
        "usb_vid": 4617,
        "usb_pid": 53251,
        "serial_number": "DRYER-FIXTURE-001",
        "manufacturer": "Example",
        "product": "Mainboard DFU"
      }
    ]
  },
  "expected_current_firmware": "dryer-simulator/0.1.0",
  "artifact": {
    "format": "dryer.controller-image/v1",
    "path": "build/mainboard/firmware.dryer.json",
    "size_bytes": 1600,
    "expected_sha256": "sha256:bb33956025312dd25f8bde38b94e17c9d9e67e7f0b374b66b78a65a00112a116",
    "observed_sha256": "sha256:bb33956025312dd25f8bde38b94e17c9d9e67e7f0b374b66b78a65a00112a116",
    "hash_matches": true,
    "deployable": false,
    "signature": null
  },
  "steps": [
    {
      "action": "inspect_artifact"
    },
    {
      "action": "select_device"
    },
    {
      "action": "check_current_firmware",
      "expected": "dryer-simulator/0.1.0"
    },
    {
      "action": "enter_bootloader",
      "instruction": "Hold BOOT while tapping RESET, then release BOOT."
    },
    {
      "action": "flash_artifact",
      "method": "dfu",
      "transport": "usb"
    },
    {
      "action": "verify_artifact",
      "method": "sha256"
    },
    {
      "action": "confirm_board",
      "expected": "boards/example-mainboard@1.0.0"
    }
  ],
  "blocked_reasons": [
    "artifact format 'dryer.controller-image/v1' is an inspectable reference image, not a deployable controller executable"
  ],
  "recovery": [
    "Re-enter DFU mode and retry with the same locked artifact.",
    "If DFU is unavailable, use the board's hardware recovery probe."
  ]
}
